Ссылка на источник,Ссылка на пост,Текст поста,Коэффициент поста,Тема 1,Тема 2,Тема 3
https://www.facebook.com/bablorub,https://www.facebook.com/bablorub/posts/3342143975814495,"Простые решения для бизнеса.
Я сейчас для себя тестирую разные подходы. И с клиентами общаюсь, советую и советуюсь. Ситуация действительно сложная. Когда вроде и надо в онлайн, но что там делать, если никогда не был. Какая переориентация, если карантин через месяц снимут. Или не снимут. Но вкладываться в новое по сути направление - и денег нет, и по времени как-то не складывается. Ведь помнишь, что такие вещи занимают месяцы, а иногда и годы. Аудитория же не появится в сети из воздуха, ее нарабатывать надо.
В голове рождаются такие варианты.
Если был маленький бизнес с эпизодическим присутствием в сети, то можно пробовать формировать спрос через более популярных людей, постепенно агрегируя аудиторию на свои аккаунты в инстаграме и других соцсетях. 
Интеграция в сообщения других лидеров мнений - в комментарии, работала и в 2008 году, и работает сейчас. К примеру, губернатор Калининградской области сам предложил в его аккаунте оставлять сообщения о своем бизнесе в комментариях. Не знаю, как там с продажами у тех, кто комментировал губернатора, но если вести такую работу регулярно хотя бы самостоятельно, и своя аудитория подписчиков будет расти. И продажи какие-то пойдут хоть немного.
Делать сайт накладно. Долго, дорого. Это шаг для тех, кто планирует долгосрочно и широким шагом заходить в онлайн. Дешево тут получится долго и плохо. Маленьким бизнесам правильнее будет сделать витрину в конструкторах. На сегодня их возможности таковы, что вам не надо долго вникать, как подобрать шаблон, как занести товары. Забейте в гугле ""конструктор сайтов Тильда"", ""конструктор сайтов Битрикс"". Да вообще просто ""конструктор сайтов"" и выберите тот, где есть возможность выложить и настроить каталог товаров.
Несколько вечеров и у вас свой сайт за ноль рублей. Только время, которое вы отнимете от просмотра новостей. Приятная цена для попробовать спрос на свой товар или услуги в интернете.
Это станет прекрасным дополнением к вашему инстраграму, витриной, где товары разложены по каталогу, а не написаны корявым шрифтом на скринах в сториз. Пусть потом пишут вам заказы в директ, но выбирают на витрине. Как выстроить коммуникацию с конечным покупателем - это уже вопрос вашей коммуникации с аудиторией. Каждый строит ее по-своему.
Приглядитесь к гугл.формам. Это прекрасный инструмент для быстрой обратной связи. За несколько минут вы можете сделать себе форму заказа на что угодно. И не нужно никаких особых знаний. Все понятно интуитивно. Парикмахер может сделать себе предварительную запись. Повар заказ доставки. Курьер - прием заказов на доставку товаров из магазинов города. Да, есть сервисы, где это можно сделать бесплатно или за небольшую плату. Но вы же тестируете спрос, а не создаете с нуля систему продаж. Наиграетесь с формой - поймете, чего не хватает. И тут уже можно переходить к выбору сервиса или заказывать что-то свое.
Я мог бы привести тут пример компании по доставке еды, которая несколько лет принимал заказы через гугл.форму, прежде чем сделать свой сайт. Просто со временем ее ассортимент настолько вырос, что форма стала слишком большой.
Избегайте в публичном обращении к аудитории просьб поддержки. Это действительно вызывает реакцию. И действительно многие откликаются. Но это создает паразитный пиковый трафик. У вас закажут не ваши целевые клиенты, которые будут потом возвращаться, а сложная эмоционально мотивированная аудитория. В итоге может сложиться ситуация, что сначала вы получите много заказов, а потом большинство уйдет спасать других, меньшинство откажется заказывать повторно, потому что их не удовлетворило качество, скорость и коммуникации. И вы останетесь только с теми, кто с вами до конца. А их очень мало. И денег у них тоже все меньше.
Работайте со словом так, чтобы было понятно, что вы принимаете эту реальность и учитесь жить в ней. Что вы просто работаете. Что печете, учите, оказываете услуги. Даже в такое непростое время. Тогда ваша лояльная аудитория будет только расти. Медленно, но верно. Это кажется мне сейчас более правильным, чем насытить волновым спросом простаивающие мощности. Лучше принять, что сидеть мы будем еще долго, сократиться по-живому, и начинать расти с нуля там, где вы еще не были или были мимоходом.
Удачи и успехов в вашем бизнесе!",,Необходимость адаптироваться под новые условия,,
https://www.facebook.com/bablorub,https://www.facebook.com/bablorub/posts/3337304856298407,"Ночью у меня инсайты.
ЧС. Это управление военными и сухпаек, а не решение проблем с кредитами и арендой. Читайте законы. 
Помощь населению деньгами - это подпитывание их базовых потребностей, а не бизнеса. 
Помощь бизнесу деньгами, это спасение тех, кто и так при смерти - ненадолго. А кто может выжить, тем это как плевок в кепку.
Что-то решить может только изменение правил игры, в которую слишком многие заигрались. И к моему сожалению, на протяжении нескольких недель, власть начинает казаться более адекватной чем бизнес.
А теперь терзайте.",,Отсутствие реформ,,
https://www.facebook.com/bablorub,https://www.facebook.com/bablorub/posts/3334308983264661,"Платежеспособность бизнеса снижается с пугающей быстротой. Общаясь с коллегами и клиентами, начинаешь понимать, насколько глубока задница.
1. Бизнес, кто мог, ушел в кэш. Слил или начал сливать персонал. Выбил арендные каникулы или съехал с офиса. Отказался от рекламы. Договорился или пытается договориться по отсрочке кредитов. Выбивает копейки из государства.
2. Держать нос по ветру не получается. Что-то не так с нынешним поколением бизнесменов. Тот кто стремительно ворвался в онлайн из оффлайна, с улыбкой идиота бежит по всем граблям, какие могут быть. 
Поверьте, найти достаточное число чудаков, которые будут видеть рекламу в фейсбуке и переходить в инстаграм, чтобы посмотреть там меню, а потом заказывать по телефону доставку на следующий день, у вас не получится. Есть сложившиеся сильные игроки в онлайн, которые и получат этот прирост, если пересмотрят свою ценовую политику и перестанут продавать пиццу по цене золота.
Надо сокращать логистику и коммуникации, а не увеличивать их. Ну, или доить лояльную базу за счет флешмобов и слезных видео ""купите булочку, мы не хотим закрываться"". Только недолго, она сохнет на глазах. Сегодня они еще поддержат вас, а завтра будет не на что.
3. Ниши, где есть рост спроса, мельчают на глазах. Тряпочные бесполезные но модные маски, которые кинулись шить все кому не лень, за неделю в рознице подешевели с 400 до 100 рублей. И это еще не предел.
Зайти в те же семена для дачи уже не получится - нет опта. А какой есть - там уже дорого. Главное же - нет опыта и нет времени его получать. Через полтора месяца лето и конец сезона.
Рынок онлайн-обучения перенасыщен как бесплатными программами, так и новыми платными. Наспех слепленные антикризисные курсы быстро теряют популярность. На их фоне падает и остальное обучение. Растут тут, как и в остальном онлайне единичные крепкие старые игроки. У которых все было отлажено до запятой. Удобно и понятно.
4. Дальше будет только хуже. Еще сильнее сброс людей на рынок труда. Еще ниже бюджеты. И переход из приостановки в закрытие или банкротство.
5. Рынок оголяется. Спроса нет, вслед за ним падает и предложение в сторону базовых потребностей. А их не так и много. Когда подушки полностью растают, большинство обнаружит, что для сытого желудка не так много денег и нужно. Что можно жить без дорогого ноутбука и сыра с плесенью. Что российский винчик не так плох, если цель просто запить им ужин. Что однослойная бумага не так уж и царапает жопу. Бизнес же просто схлопнется до лучших времен, чтобы многие уже и не открылись никогда.
Люди выживут. А бизнес большинству придется делать заново. Начинать с удовлетворения самых простых потребностей, постепенно стимулируя спрос на сложные продукты, технику, услуги, медицину, развлечения. Это будет увлекательное время, господа. Готовьтесь!
Что делать в таких условиях? Тут я пересмотрел свою позицию кардинально, учитывая быстро меняющуюся ситуацию. 
1. Пересмотреть ценовую политику в сторону мелких лотов. Демпинг не выход. Лучше дать возможность брать меньше. Хотя некоторым стоит пересмотреть свою политику наценки за счет снижения затрат.
2. Ориентировать предложение на закрытие базовых потребностей как физиков, так и юриков. Падаем по пирамиде Маслоу.
3. Пытаться оседлать хайп минимальными затратами. Это плохая долгосрочная политика, но можно заткнуть кое-какие дырки в бюджете.
4. Кооперироваться с коллегами в подобие товарищества: перелив кадров, обмен заказами, совместный поиск точек роста, совместное лоббирование интересов перед государством. Никто не хочет умирать. Помогайте друг другу.
5. Быстрый слив всех, кто не хочет договариваться. А еще хуже пытается присвоить себе все плоды вашего сотрудничества. Не стоит тратить время на такие коммуникации.
6. Стараться быть на виду. Особенно у целевой аудитории. Необязательна дистрибуция экспертного контента - у людей другим голова сейчас забита. Общайтесь, успокаивайте, плачьтесь. Это не так важно. Любая открытая позиция сойдет. Время пройдет, конкретику забудут, а человека или бренд - нет.
Берите пример с тех, кто так и делает. Битрикс24. Банк Точка. BonaFide (в лице Do4a).
Делитесь, друзья. Комментируйте. Вам мелочь, а кому-то помощь.",,Нехватка средств / закрытие бизнеса,Снижение потребительского спроса,Необходимость адаптироваться под новые условия
https://www.facebook.com/bablorub,https://www.facebook.com/bablorub/posts/3324010380961188,"Российский бизнес сейчас выглядит так. Еще с ноготочками и в шубе, но завален на бок и тревожно подсматривает, кто работает, когда ему нельзя.",,Нехватка средств / закрытие бизнеса,,
https://www.facebook.com/bablorub,https://www.facebook.com/bablorub/posts/3321417807887112,"Юра достал листочек и написал.
- Сократилась выручка на 50%.
- Убираем 30% ФЗП вообще вместе с сотрудниками. Остается 70%.
- Оставшиеся 70% режем пополам, получаем 35% от докарантинного ФЗП.
- Договоримся о скидках за аренду или каникулах. Или просто закроем офисы.
- Выходим на ноль. Можно пересидеть до конца карантина.
Собственно, а кто ожидал, что бизнес будет действовать иначе и сохранять все в полном объеме?",,Нехватка средств / закрытие бизнеса,,
https://www.facebook.com/profile.php?id=100008278056795,https://www.facebook.com/permalink.php?story_fbid=2725636624388913&id=100008278056795,"Forbes прогнозирует падение спроса практически на все. Неутешительный прогноз. Одно радует: интернет торговля процветает, практически все адаптировались к онлайн рынку. Можно не нести расходы по содержанию офлайна и при этом зарабатывать. ",,Снижение потребительского спроса,Необходимость адаптироваться под новые условия,
https://www.facebook.com/profile.php?id=100008278056795,https://www.facebook.com/permalink.php?story_fbid=2715846595367916&id=100008278056795,"В статье другой угол зрения на кризисные явления в бизнесе сегодня. Спасибо Primamedia , за поддержку предпринимательства! ",,Необходимость адаптироваться под новые условия,,
https://www.facebook.com/profile.php?id=100008278056795,https://www.facebook.com/permalink.php?story_fbid=2687089611576948&id=100008278056795,"Любого деятельного человека сейчас мучает вопрос: когда же, наконец, закончится,  вся эта история с пандемией. И даже не говорите, что это надолго.... Перемен!!! Требуют наши сердца!  ",,"Неопределенность, страх, выгорание из-за пандемии",,
https://www.facebook.com/profile.php?id=100008278056795,https://www.facebook.com/permalink.php?story_fbid=2672257959726780&id=100008278056795,"Возможность работать сейчас, это очень важно. Будем соблюдать правила дезинфекции ещё тщательней.",,,,
https://www.facebook.com/pavel.volodin.35,https://www.facebook.com/pavel.volodin.35/posts/2973980779388285?comment_id=2973983019388061,Ну что! Ограничения снимают. Цена на нефть зашкалила за 40 уе за бочку https://nefturals.ru/ Скажете случайность?,,,,
https://www.facebook.com/pavel.volodin.35,https://www.facebook.com/pavel.volodin.35/posts/2920192608100436,"Ограничения для граждан удивительно совпали с падением цен на нефть до 10уе за бочку. Послабления начались, когда цена нефти дошла до 30уе за бочку. Если полностью отменят ограничения, когда цена зашкалит за 40уе за бочку, то попытайтесь меня убедить, что это случайное совпадение!",,,,
https://www.facebook.com/pavel.volodin.35,https://www.facebook.com/pavel.volodin.35/posts/2910804845705879,"Коллекционирую способы. Ну так, для себя, на будущее. Сидение дома и выход на работу в онлайне привели к тому, что многие люди стали активнее пользоваться банковскими переводами. Но затем наступит время Ч, когда налоговая будет вызывать на допросы и спрашивать ""А откуда это у тебя, приятель, денежки пришли? А за что? А налоги уплатил?"" И тут даже не будет играть роли сумма. Важно другое. Есть деньги - плати! Нет деньги - тоже плати. Ведь налоги никто не отменял. Их отсрочили, мол, заплатите, но потом. Так как же передать деньги, например, одолженные у товарища? Один вариант - делать закладки! Как наркоманы делают закладки, так и тут с деньгами. А за то, что деньги нашёл, никто тебя в тюрьму не посадит. А вы что предложете?",,Административные препятствия для бизнеса,,
https://www.facebook.com/pavel.volodin.35,https://www.facebook.com/pavel.volodin.35/posts/2846590652127299,"Только и слышишь - короновирус. Всё закрыто, никто не работает. Ну закончится он, вирус этот. Что дальше с бизнесом будет?",,Нехватка средств / закрытие бизнеса,,
