Ссылка на источник,Ссылка на пост,Текст поста,Коэффициент поста,Тема 1,Тема 2,Тема 3
https://www.facebook.com/profile.php?id=1272038151,https://www.facebook.com/permalink.php?story_fbid=10222323323613266&id=1272038151,"В прошлый вторник мы открыли магазин Be happy после двух с половиной месяцев карантина (простите, нерабочих дней). Покупателей в ТЦ крайне мало (3/4 магазинов закрыто). Выручки смешные.
За неделю работы магазина к нам ДВАЖДЫ пришли с проверкой.
Сегодня выдали предписание об устранении несоответствий - обязали покупать рециркуляторы воздуха и заводить тонну бумажек и журналов для отчетности.
На оборудование рециркулятором отводится 12 часов. Если не успел - разрешение на работу аннулируется. Если открыл магазин без разрешения - штраф 50 т.р.
Успели, купили, повесили!
Вечером звонит тёща - Как дела? Какие новости?
Я - Норм. 2 проверки за неделю. Экстренно закупаем чудо-технику, строчим отчеты и тп.
Тёща - Странно. А по телевизору сказали, что никаких проверок малому бизнесу не будет...
Я - Ухаха!!! Вас снова нае..ли. (Подумал, но сказать не решился).",,Возобновление работы торгового предприятия,Административные препятствия для бизнеса,Нелогичность ограничительных мер
https://www.facebook.com/profile.php?id=100013627514263,https://www.facebook.com/permalink.php?story_fbid=913209412476634&id=100013627514263,"С 25 июня в Подмосковье открыты все Торговые Центры без ограничения по площади и без требования отдельного входа.Центр Интерьера ЛАДЬЯ возобновил свою работу в полном объеме.
Центр Интерьера ""Ладья""",,Возобновление работы торгового предприятия,,
https://www.facebook.com/kostya.popov,https://www.facebook.com/kostya.popov/posts/4378347032177250,"Если действительно сделают, то это многое меняет. Будет выгодно расширяться. Но это в будущем, а сейчас было бы наиболее разумным сделать перенос уплаты налогов на 2021. О прочих льготах и не мечтаю) Нас полностью проигнорировали, так как не МСП.
«По их словам, для российских IT-компаний премьер-министр Михаил Мишустин планирует снизить страховые взносы с 14 до 7,6%, а налог на прибыль – с 20 до 3%. Кроме того, он предлагает отменить НДС с рекламы разработок и софта на иностранных цифровых площадках и дать разработчикам софта возможность получать специальные субсидии»",,Недостаточные меры поддержки бизнеса,,
https://www.facebook.com/kostya.popov,https://www.facebook.com/kostya.popov/posts/4365247016820585,"Традиционные пятничные технологические новости 🙂 У нас в компании есть R&D отдел, где мы работаем над новыми продуктами, которые дополнят экосистему решений Cappasity для ритейла. Один из них - виртуальная примерочная. Сегодня я хочу продемонстрировать первую часть, которая позволяет снимать размеры с человека. Следующий шаг - совмещение Cappasity 3D View с аватаром.
Ещё много всего предстоит сделать, но стадия MVP показала, что проект будет развиваться и мы начнём его продавать уже в этом году в рамках подписки на Cappasity.",,Перспективы развития,,
https://www.facebook.com/kostya.popov,https://www.facebook.com/kostya.popov/posts/4362145330464087,"Про наше приложение пишет AutoSuccess! Респект отделу партнерств ;)
Журнал печатный. HTML-версия https://digital.autosuccessonline.com/…/produ…/default.aspx…",,"Успехи, достижения бизнеса",,
https://www.facebook.com/kostya.popov,https://www.facebook.com/kostya.popov/posts/4361489730529647,"Месяц назад мы поменяли стратегию продаж и в результате подписали нового энтерпрайз клиента из США из совсем другой категории. В начале я думал, что они будут снимать одежду, но оказалось, что на первом месте лошади ;)
Сегодня загрузили первый тест -",,"Успехи, достижения бизнеса",,
https://www.facebook.com/profile.php?id=100010251182806,https://www.facebook.com/permalink.php?story_fbid=1219435281741500&id=100010251182806,"Я люблю ездить за рулем. Конечно, не в Москве, а в дальние путешествия. Чем дальше, тем лучше. Чтобы менялись пейзажи за окном, погода, ассортимент в магазинчиках на заправках, а еще лучше люди, языки и страны. У меня есть опыт поездки из Москвы во Францию и обратно, а также путешествие по Швейцарии. Было круто.
🔻
Недавно ездил в Тамбов. У нас там находится команда разработки https://pampadu.ru. Обсуждали, как мы можем дать страховым посредникам больше возможностей для заработка.
В Тамбов самолеты из-за карантина отменили, а всю ночь спать в старом поезде, в метре от незнакомых людей и под запах куры гриль, как-то не хотелось. Поехал на машине. Во время 4.5 часов пути по трассе, состоящей из одной полосы в каждую сторону, заметил интересную аналогию с жизненной ситуации.
🔻
Когда догоняешь очередную фуру, тебе нужно обогнать, чтобы не плестись с ее скоростью. Для этого ты переключаешь внимание с любимой музыки, приятно играющей в салоне, с мыслей, которые приходят, проезжая бескрайние зеленые поля. Все внимание концентрируешь на важной и местами рисковой задаче. Выбираешь участок, где разметка разрешает обгон, немного выглядываешь из-за фуры, проверяя как далеко встречная и успеешь ли ты вернуться в свою полосу. Взвесив все за и против включаешь спорт режим, крепче сжимаешь руль, газ в пол и обходишь тех, кто тебе мешал на пути. Успешно вернувшись до того как в тебя влетит встречный автомобиль, дергаешь ручку круиз контроля, которая возвращает тебя в комфортные 140 км/ч. Теперь можно расслабиться, вернуться к музыке и мыслям, пока не догонишь очередную фуру, которая мешает комфортно двигаться дальше.
🔻
Так и в жизни, нужно в определенные периоды концентрироваться, выходить из зоны комфорта. Наш мозг будет сопротивляться, потому что он не понимает, что дискомфорт/стресс временный, ему кажется, что так будет всегда. Мы временно крепко сжимаем руль, чтобы решить очередную жизненную или бизнес задачу, которая мешает комфортно двигаться дальше.",,Вера в светлое будущее и преодоление временных трудностей,,
https://www.facebook.com/profile.php?id=100010801715141,https://www.facebook.com/permalink.php?story_fbid=1160761990960514&id=100010801715141,"Дороге друзья! Мы после долгого раздумья открыли новую торговую точку на Даниловском рынке. Место С 201,С202. Ждём любителей нашего сыра. Поддержите нас!",,Перспективы развития,,
https://www.facebook.com/dremlyugin,https://www.facebook.com/dremlyugin/posts/2317852731855338,"Пост для знакомых. Развиваем бизнес, тем более в кризис.
Многие из вас знают, что я занимался фотографией и видеосъёмкой, но после 5 лет и нескольких сотен съёмок я ушёл в другую сферу, по любви, чтобы создавать что-то большее.
Мне повезло работать с Алексеем Леоновым и Николаем Дроздовым, Президентом и Ником Вуйчичем, Юрой Белонощенко и Александром Бречаловым, сотней крутых общественных деятелей, бизнесов, проектов и просто выдающихся людей.
С 2016 года я занимаюсь интернет-маркетингом, а не так давно я стал со-основателем агентства, которое занимается комплексным маркетингом.
Мне очень нравится делать красоту и получать результаты, проводить исследования и решать проблемы конверсии сайтов, этапов CRM, делать прототипирование и систему из лендингов по продукту, услуге. Нравится развивать бизнесы.
Конечно, сейчас это делает команда из 8 человек, где каждый специалист в своей области, и есть уже реализованные успешные работы для производств, онлайн-школ, event-агенств, юристов, для таких компаний, как Ростелеком и прочее.
Теперь хочу обратиться к вам на прямую!
Если вам нужно развитие в вашем бизнесе - решение задач маркетинга, исследование конкурентов и ЦА, выход в онлайн, запуск нового продукта или улучшение продаж существующего, то я вышлю вам книгу наших работ и кейсов, и ещё, сделаем аудит текущего сайта!
Ставьте + , кому это необходимо, а если вы работаете в компании, где нужны изменения и знаете, кому мы можем быть полезны, отмечайте людей в комментариях.
Бонус для репоста! Угощу вас чашкой кофе при встрече!",,Любовь к своему делу,,
https://www.facebook.com/rubleva,https://www.facebook.com/rubleva/posts/3155956181117294,"Друзья, как вам идея создания технопарка легкой промышленности на Урале?
Делюсь своими мыслями😉",,Перспективы развития,,
https://www.facebook.com/kamila.fazlyeva,https://www.facebook.com/kamila.fazlyeva/posts/2827051730737597,"☝🏻 Вакансия в Москве. Сервис электронной подписи sign.me 👩‍💻
""Поскольку продукт очень сложный, мы ищем, в первую очередь, кандидатов, подкованных как с юридической, так и с технической стороны (знания в IT приветствуется)""
Обязанности:
Обработка входящих запросов
Поиск клиентов по всей РФ
Консультирование по продукту
Выезд на встречи и проведение встреч в офисе
Проработка и подготовка блок-схем бизнес-процессов
Подготовка коммерческих предложений
Составление Договоров
Ведение CRM, отчетности по продажам
Возможны командировки
Требования:
Юридическое/Техническое образование будет плюсом (знание 63-ФЗ будет огромным плюсом)
Продвинутый пользователь ПК
Знание основных офисных программ для работы с документами, презентациями, таблицами, схемами
Опрятный внешний вид
Уверенность в общении (придется много общаться с первыми лицами крупных компаний)
Условия:
Полностью белая высокая заработная плата (Оклад + Премии с продаж - все белое)
Высокий процент с продаж
ДМС после прохождения испытательного срока
Возможность быстро вырасти
Интересный во всех планах продукт, от которого ""горят глаза""
Дружный коллектив, кофемашина, печеньки и тд - после окончания карантина будут ждать в офисе, который расположен в 1 минуте ходьбы от метро и имеет рядом много парковочных мест.
Мичуринский проспект, 45
Зарплата от 100 000.",,"Успехи, достижения бизнеса",,
https://www.facebook.com/olga.9roslavovna,https://www.facebook.com/olga.9roslavovna/posts/10158178826900999,"Мы сейчас готовим к запуску ⚒ новую жемчужину @bestviewgroup_spb - квартиру 63м с потрясающим видом на Казанский собор💎Квартира будет рассчитана на 4 Гостей.Уютная спальня, украшением которой стал камин дореволюционной эпохи, восстановленный реставраторами Эрмитажа. Секрет кровати, который мы скоро приоткроем для Вас : Вы сможете сами выбрать каким будет Ваше утро. Насладиться красотой Казанского собора или мечтать о царской эпохе. Ведь именно такие мысли будут встречать Вас, когда Вы проснетесь.
Аромат любимого кофе ☕️ Мимолетный взгляд в зеркало камина. Ступень в зал-гостиную с арочными окнами и панорамным видом на Казанский собор. Паркет. Узоры лепнины. Вы будто в одно мгновение перенесетесь в царскую Россию 👑
Вид из просторной кухни на петербургские крыши. Вкусный завтрак 🍳 🥞 ,сегодня можно позволить себе бокал игристого🥂. Почему бы и нет😍атмосфера квартиры дарит праздничное настроение и ощущение торжества. За окном тёплое лето🌞. Непременно гулять!!знакомиться с городом, отобедать в одном из самых лучших петербургских ресторанов. Вернуться домой,чтобы полюбоваться на закат 🌅 Как он спускается на купола Казанского собора, дома Зингера, собора Спаса на Крови и крыши Невского проспекта.Отправиться на развод мостов. А потом вернуться и засыпать с самыми самыми прекрасными впечатлениями😍
Квартира будет доступна для проживания совсем скоро👏🏼
Забронировать Вы можете прямо сейчас ☎️/✅+7️⃣(9️⃣2️⃣1️⃣)9️⃣0️⃣5️⃣8️⃣8️⃣0️⃣7️⃣",,Перспективы развития,,
https://www.instagram.com/maximilian_lapin/?hl=ur,https://www.instagram.com/p/CCBhsU7ImY8/,"Безразличие работников и что из этого вышло

. Сразу после первого эфира и разбора негативных отзывов, сразу ситуация подтверждающая то, что я говорил ранее, а именно, 6 человек не смогли разобраться и начали валить друг на друга, при этом заставив человека промоутера сидеть 2 часа и ждать не понятно, что и пока я не вмешался он бы сидел до утра, смотрите и сами все увидите! . Так же показал офис и как он классно обустроен и обратная связь некоторых работников, и в конце эфира сделал розыгрыш от @pinkrabbit.ru",,Невежество / слаборазвитая деловая этика,,
https://www.instagram.com/chernigova/?hl=ru,https://www.instagram.com/p/CBpWks_JW8f/,"Надо уже начинать записывать как все развивается в ACHERS, а то потом не вспомним уже точно🙈
С трудом нашла когда я последний раз вообще писала про #история_achers
А у меня ещё историй за 5 лет 😂
Давайте про Красноярск) это из последней)
Когда наступила самоизоляция, первым делом мы начали строить планы. План был просто не останавливаться, создавать крутые вещи одну за другой, главное не опускать руки!
И я очень благодарна всей нашей команде, которая поддержала, не испугалась и мы работали как никогда! Наши конструкторы выпускали каждый месяц по 40 -50 новых изделий ещё и плюсом градацию по размерам. Тая из Сочи пробиралась по ночам в магазин 😂 чтобы вынести хоть какие-то вещи и отправить заказы клиентам 🙈
Весь Новосибирск без перерыва упаковывал посылки, у нас никогда не было столько посылок 🙈
И мы решили, что как только разрешат вновь работать магазинам одежды -мы сразу же открываем следующий магазин и выбрали город Красноярск! единогласно и сразу же! 😁 давно хотели, а по плану-то был Питер после Москвы )) За два месяца до поездки, я уже представляла какое именно помещение хочу, но чтобы его найти мы сначала стёрли ноги 😂 в прямом смысле 😂уже были без сил, уже просили знак 😂 и когда уже казалось что всё🙈 и вот он знак и вот это помещение ! И такая радость!! Прилипли к грязному окну, чтобы все разглядеть внутри, ещё не позвонив по приклеенному номеру на стекле, начали планировать что где сделаем 😂
Безграничное счастье до сих пор!
Через месяц буду встречать вас в нашем новом магазине 🤍
Теперь думаем))) какой же город следующий ? Честно, определиться не можем",,Бизнес справился с кризисом,Перспективы развития,
https://www.instagram.com/golubevfit/,https://www.instagram.com/p/CByRTlcnbLy/,"Ну что мы наконец начали тренировки в студии. 3 мес перерыв это опыт на всю жизнь. Будем надеяться, что 2 волна нас не захлестнет после конституции, как многие говорят 😊",,Возобновление работы торгового предприятия,Вера в светлое будущее и преодоление временных трудностей,
https://www.facebook.com/bablorub,https://www.facebook.com/bablorub/posts/3533709833324574,"Тайное совещание в некоей администрации. В темноте трое. 
- Совсем жопа, нужны клиенты. Много. 
- Так, а я что могу? 
- Ну, пообедайте у нас, кофе выпейте. Вон Собянин смог. 
- Не сработает, - подал голос третий. - Скандальчик нужен. 
- Так давайте я заеду как бы случайно. 
- А у нас свадьба! 
- Запрещенка, которую я снимаю на камеру! 
- И я такой, ну, извините, жопа же. Крутимся как можем. 
- А я всех накажу! Использую как повод. Никаких субсидий! 
- Не увлекайтесь, не поверят, - снова раздалось из угла. - Это субсидии на исполнение наших же требований к работе заведений. 
- Так я попугаю и отменю. Мы ж не крокодилы. 
- Каеф! 
- Зачëт! Делаем. Оплатите акцию штрафом. Надо хоть так бюджет пополнять. 
- Норм. Выставляйте счёт.",,Административные препятствия для бизнеса,Недостаточные меры поддержки бизнеса,
