Ссылка на источник,Ссылка на пост,Текст поста,Коэффициент поста,Тема 1,Тема 2,Тема 3
https://www.facebook.com/bablorub,https://www.facebook.com/bablorub/posts/3500168530012038,"Что хорошего.
Агентство май закончило с прибылью, хоть и небольшой, но зато ни одного сокращения за время карантина. Клиенты возвращаются. Новые интересные клиенты заходят. Невиданное дело, мы начали нанимать новых сотрудников в почти все отделы.
Курсы SEO. Тут все стабильно. Лето просадка (а не карантин). Но в этом потоке опять представители знакового проекта в РФ. Если бы я вешал шильдики, кто у меня учился из инхаусов и сотрудников агентств (а это за 1000 человек, как мы подсчитали недавно), то вышла бы карта наверно 10-15% крупных компаний в РФ. Карту не делаем. Люди просто рекомендуют. И это прекрасно.
Кафе с открытием ТЦ вышло сначала на 25% от прежней выручки, сейчас потихоньку подбираемся к 40%. С учетом резки постоянных затрат и изменения схемы выплат переменных, убыток за июнь будет терпимым. Но нам нужно разрешение поставить столы.
Запустили в разработку проект по партнерской программе. Тест показал интерес к теме. Надеюсь, за 2-3 месяца выкатим MVP и начнем бета-тестирование. Аналогов в интернет-пространстве нет вообще. Но есть культура в народе (как были бомбилы в такси когда-то). Говоря проще, мы поставим откаты на промышленную основу и одновременно выведем их на цивилизованные рельсы.
Мусолим интересный новый проект в общепите. Если придем к соглашению и запустим, это будет прям вау. Что называется ""а что, так можно было?"".
Готовим конференцию. Заканчиваем формирование программы. Закупаем мерч. Продумываем планы Б. Успокаиваем участников. Если все сойдется, мы будем первыми, кто это сделает после карантина. Как всегда последние несколько лет. Просто потому что у нас лучшие участники в мире. Они нам верят. А мы верим им.
Дожимаю Литрес на публикацию ""Маркетинговых сказок"". Заминка по авторским правам на обложку. А так вроде все ок. Все сказки в одном файле + неопубликованный эпилог. Когда я его дописал, глаза были на мокром месте.
Спорю со старшей дочерью, которой доверил нарисовать обложку для другой книги, которую планировал выпустить на author.today поглавно. Она уперлась и править не хочет. А я не готов поставить именно такой рисунок. Может я и не прав. Нужна фокус-группа, наверно. Кстати, она закончила школу (на домашнем обучении), в аттестате четверки и пятерки. Спрашивала вчера, кроме подставки под кофе он годится на что-то?
Третья книга замерла на 120к знаках. Придумал феерический ломающий всю логику повествования конец, но надо сделать хорошее тело в середине. И там не все складывается. Думаю.
Пошла клубника. Пока по литру в день. Дети счастливы. Заплодоносил голубичный куст на третий год после посадки. Черешни литр-два соберем. Смородины мало. Вишни тоже в сравнении с годом ранее. Зато малины будет валом, хоть куст и один всего. Более того, с нее что-то нападало на землю и теперь у нас еще 4 детеныша малины выросли. Ежевика ожила, как в тень пересадил, жду стакан ягод в этом году.
А посты в фб это так, когда свободная минутка выдается. Знаю же, что обсуждаете. :)
Кстати, число подписчиков пробило отметку в 10000, и каждый пост, по моей оценке, появляется на устройствах от 3 до 100 тысяч человек, зависит от числа комментариев и репостов. Меня читают родственники моих подписчиков. Это вообще огонь.",,Бизнес справился с кризисом,Перспективы развития,"Успехи, достижения бизнеса"
https://www.facebook.com/bablorub,https://www.facebook.com/bablorub/posts/3499145196781038,"Это просто огнище! Бизнес пинками загоняют в серую зону все дальше и дальше.
https://www.znak.com/2020-06-17/obyazannost_platit_zarplaty_v_nerabochie_oplachivaemye_dni_zakrepyat_v_trudovom_kodekse",,Административные препятствия для бизнеса,,
https://www.facebook.com/pavel.volodin.35,https://www.facebook.com/pavel.volodin.35/posts/3010471369072559?comment_id=3010471679072528,"Зарплата
 высококвалифицированных работников будет снижаться, потому что будет 
переизбыток высококвалифицированных работников на рынке труда. Так 
говорят наши «любимые» власти. Лично моё мнение – зарплата 
высококвалифицированных работников будет снижаться, потому что кое-кто 
(не будем показывать пальцем кто, это и так очевидно) не исполнил своего
 обещания создать 25 миллионов рабочих мест в технологических и 
инновационных отраслях промышленности. Но законы логики неумолимы. При 
растущей экономике часто ощущается дефицит кадров. А у нас их избыток. 
Поэтому все бла-бла-бла про рост экономики – это красивые фантики. 
Кстати, а куда денутся те высококвалифицированные работники, которые не 
найдут работу? Многие уедут работать на благо экономик других 
государств. А это следующая петля деградации экономики…",,Отсутствие реформ,,
https://www.facebook.com/EkaterinaRumyantseva.Kalinka,https://www.facebook.com/EkaterinaRumyantseva.Kalinka/posts/3017636781689814,"Обещала я вам рассказать о моей настольной книге? Конечно, их несколько, они меняются. Сейчас перечитываю «Взрывной рост» Салима Исмаила. Он пишет о том, к чему мы в Калинке интуитивно пришли уже давно. Мир меняется — но уже не теми темпами, что раньше. Сейчас он и вовсе перевёрнут вверх дном. Единственная правильная стратегия для бизнеса в этом новом, странном, пугающем неопределённостью мире — постоянное тестирование гипотез, поддержка стартапов. Не всех подряд, тех, в которые веришь, ставя себя на место своего клиента.
▪
Важно: если ты перестаёшь тестировать гипотезы и переходишь на аксиомы — у тебя нет будущего. Каждый день надо искать новые формы общения с клиентами, новые услуги, новые идеи.
▪
Я ищу — и нахожу. Из найденного не так давно: решили принимать участие в аукционах Литфонда. Этот уважаемый аукционный дом давно и успешно продаёт антикварные книги, живопись, графику и предметы декоративно-прикладного искусства, проводит около 50 аукционов в год в Москве и Санкт-Петербурге.
▪
И этой весной Литфонд открыл новое направление — недвижимость. Уже первый онлайн-аукцион показал отличные результаты: было выставлено 10 лотов, из которых 3 были проданы, причём один из них ушёл за цену, в 2,5 раза превысившую эстимейт. Это шедевральная (без преувеличения) квартира в знаменитом доме Довлатова на улице Рубинштейна в Петербурге, 150 квадратных метров чистого дизайна. Искренне завидую победителю, получившему в собственность этот лот.
▪
Мы будем участвовать в следующем аукционе, в июле. Выставим объекты на 1,2 млрд рублей. И да, там будут совершенно уникальные лоты, не пропустите! Всех секретов сейчас раскрывать не буду, немного поинтригую вас. Но конечно, потом не утерплю и расскажу, время позволяет.
▪
Надеюсь, вы уже включили это событие в ваши планы на лето? Вот и отлично, не забудьте подписаться на мой блог, если ещё не подписаны. И регистрируйтесь на аукцион на сайте Литфонда: https://www.litfund.ru/registration/
Правила регистрации для участия в торгах:
Вам необходимо зарегистрироваться на те торги, в которых вы хотите принять участие. При регистрации необходимо предоставить ваши контактные данные, заполнив регистрационную форму на сайте Литфонда. При персональной регистрации необходимо иметь удостоверение личности и предоставить ваши контактные данные, заполнив регистрационную форму у ресепшиониста. Устроитель аукциона вправе по своему усмотрению затребовать выписки со счетов и другие финансовые документы, подтверждающие платежеспособность участника аукциона.
Если вы регистрируетесь в первый раз, то вам необходимо внести обеспечительный платеж в размере 100 000 рублей на расчетный счет Аукционного дома. Обеспечительный платеж для участия в аукционе служит обеспечением исполнения обязательства победителя аукциона по заключению договора купли-продажи и оплате приобретенного на торгах имущества. Обеспечительный платеж возвращается всем участникам аукциона, кроме победителя, в течение 5 (пяти) календарных дней с даты подведения итогов аукциона. Обеспечительный платеж, перечисленный победителем аукциона, возвращается по факту заключения договора купли-продажи.",,Необходимость адаптироваться под новые условия,,
https://www.facebook.com/EkaterinaRumyantseva.Kalinka,https://www.facebook.com/EkaterinaRumyantseva.Kalinka/posts/3012250438895115,"#этотдень
...настал. Мы снова в любимом офисе! И хотя обниматься пока нельзя, над масками у всех счастливые глаза. Да, не расслабляемся: ведь о победе над вирусом говорить пока рано. Вокруг твердят, что мы вышли на плато, но число смертей с подтверждённым ковидом и в Москве, и в целом по России то падает, то вновь начинает расти. И если не принимать защитных мер, то карантин придётся вводить снова, и очень скоро.
▪
Но уже можно стричься, ходить и ездить повсюду без пропусков —и работать, как раньше. Это радует больше всего. Хоть лично я и восприняла время карантина со смирением и нашла в нем внутренний покой, возможность побыть наедине с собой, много читать, много молиться — всё же свобода передвижения бесценна. Это как разговение после поста: взрыв эмоций от самых простых вещей и процессов. Живые люди, мои дорогие сотрудники, партнёры — и не на экране, а в одной комнате со мной! Оказывается, это дорогого стоит. Вот уж правда: надо испытать жажду, чтобы напиться.
▪
Тем временем премиум-рынок оживает. За первый же бескарантинный день нам в колл-центр поступило втрое больше звонков, чем в самые урожайные — а такие случались — дни апреля и мая. И звонят качественные клиенты, которые ждали этого дня. Кстати, активность на загородном рынке продолжается, хотя мы ожидали, что в июне она традиционно спадёт. Но нет, те, кому не повезло снять хороший дом на лето, начали рассматривать длительную аренду, а некоторые переориентировались на покупку, чтобы не испытывать проблем с поиском каждый год. Ренессанс, как я и говорила!
▪
Городскую недвижимость тоже активно смотрят, запросов на консультации много, нам есть чем порадовать застройщиков. Прибавилось инвесторов, но это неудивительно: ведь наш Клуб инвесторов стал настоящей точкой притяжения, и мы на вебинарах и на других площадках — в том числе и я в этом самом блоге — много рассказывали о новых инвестиционных возможностях, возникающих прямо сейчас в связи с наступлением кризиса, на котором можно и нужно заработать.
▪
Работаем! В ближайших сериях расскажу вам про миллиард рублей на аукцион, о своей настольной книге и о ваших планах на лето. Ставьте лайк, если вам это интересно, а мой блог в приоритет, чтобы ничего не пропустить.",,"Успехи, достижения бизнеса",Вера в светлое будущее и преодоление временных трудностей,
https://www.facebook.com/tatulova,https://www.facebook.com/tatulova/posts/3072997756111236,"Самое сложное для меня чувство это бессилие. Не знаю как у вас - у меня прямо зубы крошатся когда я так чувствую.
Парадом сегодня завершается коротенькая рабочая неделя из двух дней, на которой нашлась ещё одна национальная идея ( первая желание лежать на печи за зарплату) .
Вчера Президент объявил увеличение налога НДФЛ до 15%.
‼️Не путать с прогрессивной шкалой. ( прогрессивная это снизить в стартовой точке и увеличить в конечной. Здесь нет. Это про другое)
✅ Это реализация великой национальной идея: отнять у богатых и отдать бедным. И не просто бедным.
А бедным и больным детям.
Тут тоже масса художественных произведений было. На которых нация воспитана.
Мальчиш-плохиш, буржуины, Павлик Морозов, «Берегись автомобиля» ну и бессмертный самый подходящий к этой ситуации «Союз меча и орала» из 12 стульев.
Дети вас не забудут.
В общем вернулись к истокам.
Мало кто за границами фб задумается о том , что до сих пор помощь больным детям оказывалась фондами. И уверена что дальше так и будет.
А деньги у фондов брались не от государства. Нет. Ни вместо парадов, ни из зарплат Роснефти, ни вместо содержания различных надзорных органов . нет.
Из содержания фондов предпринимателями и впахивающими сотрудниками. У которых надо отнять и поделить.
И мы же понимаем, что налоги сами за себя сотрудники у нас не платят. Их компании платят.
За сотрудников.
Государство не может осилить пару лет отмену запрета на ввоз лекарств для детей с СМА, но это оказывается у них просто денег не было.
А тут уж заживем.
Отнимем и поделим. Но скорее просто отнимем.
🔥”Раскулачивание как инновационный метод социальной ответственности"" с* Саша Бабкина
Как иллюстрация вечности этой темы для нашей страны - две открытки внизу. Они реальные, российские.
Из архивов.
Одна 1923 года, вторая 1957 года.
С праздником вас, очередным.
Пойду поработаю.
Ваш капиталист.",,Отсутствие реформ,,
https://www.facebook.com/tatulova,https://www.facebook.com/tatulova/posts/3066453150099030,"Сидела работала под «Своя игра» на НТВ. Смотреть невозможно, программа через каждые 15 минут прерывается истерической рекламой поправок.
Звёзды разных величин рассказывают что именно новая замечательная конституция спасёт:
- нашу медицину
- наше образование
- наших детей
И вот прям здесь огонь: она даст нам право на труд. Ну наконец-то.
Мы почему раньше то так себе жили - это у нас конституция мешала нам медициной и образованием заниматься, работать как китайцы, бизнес развивать как в Сингапуре.
Все как в мультике « это у нас велосипеда не было...»
Ща заживем.
Но прорыв в сознании у меня произошёл не в этом даже.
Мне кажется я поняла главное - почему такой поддержкой пользуются те , кто сейчас у власти. И знаете что - они очень умные.
Дело не в президенте, дело в мечтах жителей нашей великой страны. В нас самих. Нам дали нашу мечту.
Последние три месяца примерно 60-ти % ( судя по официальной статистике) гражданам нашей родины удалось осуществить все о чем мечталось с русских сказок и периода МММ до сегодняшнего дня : бездельничать дома за деньги.
🔥тридцать лет и три года лежал Иван на печи.
🔥по щучьему велению по моему хотению
🔥хочется есть , да не хочется лезть
🔥мы сидим, а денежки идут
И много ещё ...
Так наша страна добилась того о чем много лет лет мечтали миллионы россиян. Чем не национальная идея.
Давно пора праздник сделать, день русской лени. Каждая первая среда месяца.",,Отсутствие реформ,,
